{
  "$schema": "https://json-schema.org/draft/2020-12/schema",
  "type": "object",
  "properties": {
    "$schema": {
      "type": "string"
    },
    "id": {
      "type": "string",
      "pattern": "^[a-z][a-z0-9-]{2,63}$"
    },
    "name": {
      "type": "string",
      "minLength": 1,
      "maxLength": 60
    },
    "description": {
      "default": "",
      "type": "string",
      "maxLength": 240
    },
    "version": {
      "type": "string",
      "pattern": "^\\d+\\.\\d+\\.\\d+$"
    },
    "kind": {
      "default": "carousel",
      "type": "string",
      "enum": ["carousel", "report"]
    },
    "channel": {
      "type": "string",
      "enum": ["instagram", "linkedin", "facebook", "tiktok"]
    },
    "format": {
      "type": "string",
      "enum": ["ig_4x5", "linkedin_doc", "ig_1x1", "stories_9x16", "fb_4x5", "tiktok_photo"]
    },
    "width": {
      "type": "integer",
      "minimum": -9007199254740991,
      "maximum": 9007199254740991
    },
    "height": {
      "type": "integer",
      "minimum": -9007199254740991,
      "maximum": 9007199254740991
    },
    "slides": {
      "type": "object",
      "properties": {
        "min": {
          "type": "integer",
          "minimum": 1,
          "maximum": 20
        },
        "max": {
          "type": "integer",
          "minimum": 1,
          "maximum": 20
        },
        "default": {
          "type": "integer",
          "minimum": 1,
          "maximum": 20
        }
      },
      "required": ["min", "max", "default"]
    },
    "safeZone": {
      "type": "object",
      "properties": {
        "top": {
          "type": "integer",
          "minimum": 0,
          "maximum": 600
        },
        "right": {
          "type": "integer",
          "minimum": 0,
          "maximum": 600
        },
        "bottom": {
          "type": "integer",
          "minimum": 0,
          "maximum": 600
        },
        "left": {
          "type": "integer",
          "minimum": 0,
          "maximum": 600
        }
      },
      "required": ["top", "right", "bottom", "left"]
    },
    "styles": {
      "minItems": 1,
      "maxItems": 8,
      "type": "array",
      "items": {
        "type": "string",
        "pattern": "^[a-z0-9][a-z0-9._-]*(\\/[a-z0-9][a-z0-9._-]*)*$"
      }
    },
    "fonts": {
      "default": [],
      "maxItems": 12,
      "type": "array",
      "items": {
        "type": "object",
        "properties": {
          "family": {
            "type": "string",
            "minLength": 1,
            "maxLength": 80
          },
          "file": {
            "type": "string",
            "pattern": "^[a-z0-9][a-z0-9._-]*(\\/[a-z0-9][a-z0-9._-]*)*$"
          },
          "weight": {
            "default": "400",
            "type": "string",
            "pattern": "^\\d{3}( \\d{3})?$"
          },
          "style": {
            "default": "normal",
            "type": "string",
            "enum": ["normal", "italic"]
          },
          "license": {
            "type": "string",
            "maxLength": 40
          }
        },
        "required": ["family", "file"]
      }
    },
    "colorRoles": {
      "type": "object",
      "propertyNames": {
        "type": "string",
        "pattern": "^--fc-[a-z0-9-]{1,40}$"
      },
      "additionalProperties": {
        "type": "object",
        "properties": {
          "role": {
            "type": "string",
            "enum": [
              "background",
              "surface",
              "text.primary",
              "text.secondary",
              "accent",
              "cta.bg",
              "cta.text"
            ]
          },
          "fallback": {
            "type": "string",
            "pattern": "^#(?:[0-9a-fA-F]{3}|[0-9a-fA-F]{6})$"
          }
        },
        "required": ["role", "fallback"]
      }
    },
    "fontRoles": {
      "default": {},
      "type": "object",
      "propertyNames": {
        "type": "string",
        "pattern": "^--fc-[a-z0-9-]{1,40}$"
      },
      "additionalProperties": {
        "type": "object",
        "properties": {
          "role": {
            "type": "string",
            "enum": ["heading", "body"]
          },
          "fallback": {
            "type": "string",
            "minLength": 1,
            "maxLength": 80
          }
        },
        "required": ["role", "fallback"]
      }
    },
    "typeScale": {
      "default": [],
      "maxItems": 30,
      "type": "array",
      "items": {
        "type": "number",
        "exclusiveMinimum": 0
      }
    },
    "layouts": {
      "minItems": 1,
      "maxItems": 24,
      "type": "array",
      "items": {
        "type": "object",
        "properties": {
          "id": {
            "type": "string",
            "pattern": "^[a-z][a-z0-9-]{0,39}$"
          },
          "name": {
            "type": "string",
            "minLength": 1,
            "maxLength": 60
          },
          "role": {
            "type": "string",
            "enum": [
              "cover",
              "text",
              "list",
              "quote",
              "data",
              "problem_solution",
              "comparison",
              "cta"
            ]
          },
          "position": {
            "default": "any",
            "type": "string",
            "enum": ["first", "last", "any"]
          },
          "file": {
            "type": "string",
            "pattern": "^[a-z0-9][a-z0-9._-]*(\\/[a-z0-9][a-z0-9._-]*)*$"
          },
          "safeZone": {
            "type": "object",
            "properties": {
              "top": {
                "type": "integer",
                "minimum": 0,
                "maximum": 600
              },
              "right": {
                "type": "integer",
                "minimum": 0,
                "maximum": 600
              },
              "bottom": {
                "type": "integer",
                "minimum": 0,
                "maximum": 600
              },
              "left": {
                "type": "integer",
                "minimum": 0,
                "maximum": 600
              }
            },
            "required": ["top", "right", "bottom", "left"]
          },
          "slots": {
            "maxItems": 16,
            "type": "array",
            "items": {
              "oneOf": [
                {
                  "type": "object",
                  "properties": {
                    "name": {
                      "type": "string",
                      "pattern": "^[a-z][a-z0-9_]{0,31}$"
                    },
                    "type": {
                      "type": "string",
                      "const": "text"
                    },
                    "label": {
                      "type": "string",
                      "maxLength": 60
                    },
                    "maxChars": {
                      "type": "integer",
                      "minimum": 1,
                      "maximum": 1000
                    },
                    "maxLines": {
                      "type": "integer",
                      "minimum": 1,
                      "maximum": 30
                    },
                    "required": {
                      "default": false,
                      "type": "boolean"
                    },
                    "highlight": {
                      "default": false,
                      "type": "boolean"
                    }
                  },
                  "required": ["name", "type", "maxChars"]
                },
                {
                  "type": "object",
                  "properties": {
                    "name": {
                      "type": "string",
                      "pattern": "^[a-z][a-z0-9_]{0,31}$"
                    },
                    "type": {
                      "type": "string",
                      "const": "list"
                    },
                    "label": {
                      "type": "string",
                      "maxLength": 60
                    },
                    "maxChars": {
                      "type": "integer",
                      "minimum": 1,
                      "maximum": 500
                    },
                    "minItems": {
                      "default": 0,
                      "type": "integer",
                      "minimum": 0,
                      "maximum": 12
                    },
                    "maxItems": {
                      "type": "integer",
                      "minimum": 1,
                      "maximum": 12
                    },
                    "required": {
                      "default": false,
                      "type": "boolean"
                    },
                    "highlight": {
                      "default": false,
                      "type": "boolean"
                    }
                  },
                  "required": ["name", "type", "maxChars", "maxItems"]
                },
                {
                  "type": "object",
                  "properties": {
                    "name": {
                      "type": "string",
                      "pattern": "^[a-z][a-z0-9_]{0,31}$"
                    },
                    "type": {
                      "type": "string",
                      "const": "image"
                    },
                    "label": {
                      "type": "string",
                      "maxLength": 60
                    },
                    "minWidth": {
                      "type": "integer",
                      "minimum": 1,
                      "maximum": 8000
                    },
                    "minHeight": {
                      "type": "integer",
                      "minimum": 1,
                      "maximum": 8000
                    },
                    "required": {
                      "default": false,
                      "type": "boolean"
                    }
                  },
                  "required": ["name", "type"]
                }
              ]
            }
          },
          "sample": {
            "default": {},
            "type": "object",
            "propertyNames": {
              "type": "string"
            },
            "additionalProperties": {
              "anyOf": [
                {
                  "type": "string",
                  "maxLength": 2000
                },
                {
                  "maxItems": 12,
                  "type": "array",
                  "items": {
                    "type": "string",
                    "maxLength": 500
                  }
                },
                {
                  "type": "object",
                  "properties": {
                    "asset": {
                      "type": "string",
                      "pattern": "^[a-z0-9][a-z0-9._-]*(\\/[a-z0-9][a-z0-9._-]*)*$"
                    },
                    "alt": {
                      "type": "string",
                      "maxLength": 300
                    }
                  },
                  "required": ["asset"]
                }
              ]
            }
          }
        },
        "required": ["id", "name", "role", "file", "slots"]
      }
    },
    "rules": {
      "default": {
        "ctaOnlyLast": true,
        "logoOnCover": true,
        "pageNumbers": true,
        "maxImagesPerSlide": 1,
        "notes": ""
      },
      "type": "object",
      "properties": {
        "ctaOnlyLast": {
          "default": true,
          "type": "boolean"
        },
        "logoOnCover": {
          "default": true,
          "type": "boolean"
        },
        "pageNumbers": {
          "default": true,
          "type": "boolean"
        },
        "maxImagesPerSlide": {
          "default": 1,
          "type": "integer",
          "minimum": 0,
          "maximum": 4
        },
        "notes": {
          "default": "",
          "type": "string",
          "maxLength": 500
        }
      }
    }
  },
  "required": [
    "id",
    "name",
    "version",
    "channel",
    "format",
    "width",
    "height",
    "slides",
    "styles",
    "colorRoles",
    "layouts"
  ],
  "title": "Forgecy template.json"
}
